company_name,record_id,Status,pages_per_visit,time_on_site,direct_traffic,search_traffic,social_traffic,referral_traffic,paid_referral_traffic,mail_traffic,top_country,global_rank,country_rank,site_title,site_description,top_keywords,is_small_site,has_ga_data,snapshot_date,traffic_month_1_date,traffic_month_1,traffic_month_2_date,traffic_month_2,traffic_month_3_date,traffic_month_3,raw_analytics_data,campaign_link,website url,primary_domain,industry,estimated_num_employees,location,city,state,country,linkedin_url,general_email,phone_number,winter_activities,qualified_for_campaign,qualification_reason,apollo_source,enrichment_status,perplexity_research,organization_short_description,organization_seo_description,keywords,annual_revenue,technology_stack,social_media_presence,last_updated,notes,Company Overview Summary,Company Data Quality Assessment,Campaign_1_2024_Winter_Tour_Operators_Individuals,apollo_segment_source,apollo_search_url,2025-07_C001_WinterTour_EmailTemplate_TESTING copy,2025-07_C001_WinterTour_EmailTemplate_TESTING copy.1,2025-07_C001_WinterTour_EmailTemplate_TESTING copy.2,2025-07_C001_WinterTour_EmailTemplate_TESTING copy 2,2025-07_C001_WinterTour_EmailTemplate_INDIVIDUALS copy,has_chatbot,chatbot_analysis,chatbot_types_detailed,booking_technology_summary,booking_technology_detailed,ota_analysis,ota_dependencies_detailed,prospect_evaluation,pages_analyzed,has_contact_form,has_online_booking,external_booking_links,analysis_confidence,last_analyzed,analysis_status
Brighton Resort,recjg4qC6a5qF24gG,Processed,4.87,207,36.94%,53.70%,2.76%,5.41%,1.05%,0.11%,"[{""Country"":826,""CountryCode"":""GB"",""Value"":0.7164896454548899},{""Country"":840,""CountryCode"":""US"",""Value"":0.12689509763661483},{""Country"":56,""CountryCode"":""BE"",""Value"":0.048093402238484954},{""Country"":36,""CountryCode"":""AU"",""Value"":0.026295328913610354},{""Country"":372,""CountryCode"":""IE"",""Value"":0.021578139153065546}]",326384,826,Chill Factore | Indoor Skiing & Snowboarding | Manchester,"skiing & snowboarding for everyone, visit chill factore the home of the uk's longest indoor snow slope! discover a new skill or have some snowy fun in manchester.","[{""Name"":""chill factore"",""EstimatedValue"":990,""Volume"":1460,""Cpc"":1.32},{""Name"":""chill factor"",""EstimatedValue"":150,""Volume"":420,""Cpc"":1.51},{""Name"":""chill factory traford park"",""EstimatedValue"":150,""Volume"":160,""Cpc"":null},{""Name"":""chillfactor manchester"",""EstimatedValue"":120,""Volume"":130,""Cpc"":null},{""Name"":""chill factore – indoor snow slope"",""EstimatedValue"":120,""Volume"":120,""Cpc"":null}]",False,False,2025-06-01 02:00,2025-06-01,77582,2025-05-01,56345,2025-04-01,56392,"{""similarwebcompletedata"":{""visits"":43362,""bouncerate"":0.43822032457288307,""pagespervisit"":4.2506422338430605,""timeonsite"":99.3735413573106,""trafficsources"":{""Social"":0.006762331368423406,""Paid Referrals"":0.003955412933626189,""Mail"":0.0007432754712629996,""Referrals"":0.03158150844699164,""Search"":0.5243209268095652,""Direct"":0.43263654497013043},""topcountries"":[{""Country"":840,""CountryCode"":""US"",""Value"":0.9552101161324563},{""Country"":826,""CountryCode"":""GB"",""Value"":0.02693244206345402},{""Country"":124,""CountryCode"":""CA"",""Value"":0.01785744180408937}],""rankings"":{""global"":512250,""country"":120383,""category"":{""Rank"":""65"",""Category"":""Sports/WinterSports""}},""topkeywords"":[{""Name"":""brighton"",""EstimatedValue"":1470,""Volume"":276270,""Cpc"":1.42},{""Name"":""brighton ski resort"",""EstimatedValue"":1070,""Volume"":1610,""Cpc"":0.85},{""Name"":""brighton resort"",""EstimatedValue"":770,""Volume"":670,""Cpc"":1.07},{""Name"":""brighton utah"",""EstimatedValue"":450,""Volume"":1110,""Cpc"":1.48},{""Name"":""brighton resort utah"",""EstimatedValue"":390,""Volume"":110,""Cpc"":0.85}],""snapshotdate"":""2025-06-01T00:00:00+00:00"",""estimatedmonthlyvisits"":{""2025-04-01"":169248,""2025-05-01"":68169,""2025-06-01"":43362}},""processinginfo"":{""processedat"":""2025-07-31T09:41:14.268Z"",""domain"":""brightonresort.com"",""company"":""Brighton Resort"",""original_domain"":""brightonresort.com""}}",2025-07_C002_WinterTour_GamifiedChatbot,http://www.brightonresort.com,brightonresort.com,"[""recreational facilities"",""mountain ecosystem"",""parking reservations"",""summer activities"",""disc golf"",""night riding"",""summer operations"",""live cams"",""adventure learning"",""lift tickets"",""progression focus"",""trail maps"",""community focus"",""snow conditions"",""skiing"",""mountain biking"",""ski resort"",""snowfall"",""scenic views"",""leisure, travel & tourism"",""creative self-expression"",""winter sports"",""outdoor exploration"",""medical services"",""family friendly"",""camp brighton"",""recreation & sports"",""terrain diversity"",""snowboarding"",""inclusive vibe"",""summer camps"",""season passes"",""bike trails"",""ski resorts"",""community gathering"",""high-altitude fun"",""utah snow"",""terrain parks"",""scenic lift rides"",""b2c"",""services"",""fitness and recreational sports centers"",""community"",""lodging"",""shopping"",""facilities services"",""communities"",""active life"",""american (traditional)"",""bars"",""hiking"",""hotels"",""hotels & travel"",""nightlife"",""restaurants""]",0,"8302 south brighton loop road, brighton, utah 84121, us",Salt Lake City,Utah,United States,http://www.linkedin.com/company/brightonresort,,18015324731,,,,,,,,,"recreational facilities, mountain ecosystem, parking reservations, summer activities, disc golf, night riding, summer operations, live cams, adventure learning, lift tickets, progression focus, trail maps, community focus, snow conditions, skiing, mountain biking, ski resort, snowfall, scenic views, leisure, travel & tourism, creative self-expression, winter sports, outdoor exploration, medical services, family friendly, camp brighton, recreation & sports, terrain diversity, snowboarding, inclusive vibe, summer camps, season passes, bike trails, ski resorts, community gathering, high-altitude fun, utah snow, terrain parks, scenic lift rides, b2c, services, fitness and recreational sports centers, community, lodging, shopping, facilities services, communities, active life, american (traditional), bars, hiking, hotels, hotels & travel, nightlife, restaurants",0,,,,,,,,,https://app.apollo.io/#/companies?organizationNumEmployeesRanges%5B%5D=101%2C200&organizationNumEmployeesRanges%5B%5D=51%2C100&organizationNumEmployeesRanges%5B%5D=21%2C50&organizationNumEmployeesRanges%5B%5D=11%2C20&organizationNumEmployeesRanges%5B%5D=1%2C10&organizationLocations%5B%5D=United%20States&organizationLocations%5B%5D=Canada&organizationLocations%5B%5D=Europe&organizationLocations%5B%5D=Japan&organizationLocations%5B%5D=New%20Zealand&organizationLocations%5B%5D=Australia&qOrganizationKeywordTags%5B%5D=snow&qOrganizationKeywordTags%5B%5D=winter&qOrganizationKeywordTags%5B%5D=winter%20sports&qOrganizationKeywordTags%5B%5D=winter%20activities&qOrganizationKeywordTags%5B%5D=arctic&qOrganizationKeywordTags%5B%5D=tour%20operators&qOrganizationKeywordTags%5B%5D=sightseeing%20tours&qOrganizationKeywordTags%5B%5D=travel%20agency&qOrganizationKeywordTags%5B%5D=snowboarding&qOrganizationKeywordTags%5B%5D=skiing&qOrganizationKeywordTags%5B%5D=polar&includedOrganizationKeywordFields%5B%5D=tags&includedOrganizationKeywordFields%5B%5D=name&organizationIndustryTagIds%5B%5D=5567cdd87369643bc12f0000&revenueRange%5Bmax%5D=5000000&page=1&sortAscending=false&sortByField=recommendations_score,,,,,,,,,,,,,,,,,,,,
Different Snow,recLQmKp6VCikMIY6,Processed,1.9,51,35.67%,43.89%,4.29%,13.85%,0.85%,0.25%,"[{""Country"":826,""CountryCode"":""GB"",""Value"":0.9999999999999999}]",8401284,0,Different Snow - the tailor-made Japan ski specialists | Different Snow,"we create tailor-made luxury ski and snowboarding holidays to japan, featuring 12 ski resorts across both hokkaido and honshu island.","[{""Name"":""shiga kogen"",""EstimatedValue"":0,""Volume"":3840,""Cpc"":1.07},{""Name"":""zao onsen"",""EstimatedValue"":0,""Volume"":2850,""Cpc"":1.44},{""Name"":""skiing in japan"",""EstimatedValue"":0,""Volume"":2170,""Cpc"":0.79},{""Name"":""suginohara off piste"",""EstimatedValue"":0,""Volume"":630,""Cpc"":null},{""Name"":""japan skiing"",""EstimatedValue"":0,""Volume"":590,""Cpc"":1.3}]",False,False,2025-06-01 02:00,2025-06-01,913,2025-05-01,1087,2025-04-01,1111,"{""similarwebcompletedata"":{""visits"":913,""bouncerate"":0.40552488892542765,""pagespervisit"":1.898253698639812,""timeonsite"":51.09649667256159,""trafficsources"":{""Social"":0.042860941403841446,""Paid Referrals"":0.008462750915181809,""Mail"":0.0024806697811186156,""Referrals"":0.13847520921885906,""Search"":0.4388602831208004,""Direct"":0.3567367563731861},""topcountries"":[{""Country"":826,""CountryCode"":""GB"",""Value"":0.9999999999999999}],""rankings"":{""global"":8401284,""country"":0,""category"":{""Rank"":null,""Category"":null}},""topkeywords"":[{""Name"":""shiga kogen"",""EstimatedValue"":0,""Volume"":3840,""Cpc"":1.07},{""Name"":""zao onsen"",""EstimatedValue"":0,""Volume"":2850,""Cpc"":1.44},{""Name"":""skiing in japan"",""EstimatedValue"":0,""Volume"":2170,""Cpc"":0.79},{""Name"":""suginohara off piste"",""EstimatedValue"":0,""Volume"":630,""Cpc"":null},{""Name"":""japan skiing"",""EstimatedValue"":0,""Volume"":590,""Cpc"":1.3}],""snapshotdate"":""2025-06-01T00:00:00+00:00"",""estimatedmonthlyvisits"":{""2025-04-01"":1111,""2025-05-01"":1087,""2025-06-01"":913}},""processinginfo"":{""processedat"":""2025-07-31T09:41:14.277Z"",""domain"":""differentsnow.com"",""company"":""Different Snow"",""originaldomain"":""differentsnow.com""}}",2025-07_C002_WinterTour_GamifiedChatbot,http://www.differentsnow.com,differentsnow.com,"[""tailormade travel skiing snowboarding snowmobiling winter adventure cultural touring"",""tailormade travel"",""snowboarding"",""winter adventure"",""skiing"",""cultural touring"",""northern lights"",""arctic"",""snowmobiling"",""husky safaris"",""off-piste skiing japan"",""ski lift passes japan"",""japanese ski villages"",""skiing in remote japan"",""skiing in hokkaido and honshu"",""custom ski itineraries"",""ski resorts japan"",""ski guide japan"",""skiing with local guides"",""heli-skiing japan"",""backcountry ski japan"",""myoko kogen"",""japan ski tour operator"",""backcountry skiing japan"",""ski guiding japan"",""ski touring japan"",""japanese ski resorts"",""niseko ski resort"",""ski travel japan"",""skiing in volcanic terrain"",""ski accommodation japan"",""travel services"",""japanese culture and onsens"",""personalized ski holidays"",""skiing off-piste japan"",""japanese winter experiences"",""skiing with japanese guides"",""powder snow japan"",""custom ski packages japan"",""japanese ski culture"",""tourism"",""tailor-made japan ski holidays"",""hakuba valley"",""nozawa onsen"",""ski travel insurance japan"",""ski lessons japan"",""luxury ski holidays japan"",""furano ski"",""ski and snowboard trips japan"",""ski equipment rental japan"",""private ski guides japan"",""recreational services"",""b2c"",""services"",""travel agencies"",""leisure, travel & tourism""]",0,"lauriston house, montpellier street, cheltenham, gloucestershire gl50 1ss, gb",Cheltenham,England,United Kingdom,http://www.linkedin.com/company/different-snow,,441242242505,,,,,,,,,"tailormade travel skiing snowboarding snowmobiling winter adventure cultural touring, tailormade travel, snowboarding, winter adventure, skiing, cultural touring, northern lights, arctic, snowmobiling, husky safaris, off-piste skiing japan, ski lift passes japan, japanese ski villages, skiing in remote japan, skiing in hokkaido and honshu, custom ski itineraries, ski resorts japan, ski guide japan, skiing with local guides, heli-skiing japan, backcountry ski japan, myoko kogen, japan ski tour operator, backcountry skiing japan, ski guiding japan, ski touring japan, japanese ski resorts, niseko ski resort, ski travel japan, skiing in volcanic terrain, ski accommodation japan, travel services, japanese culture and onsens, personalized ski holidays, skiing off-piste japan, japanese winter experiences, skiing with japanese guides, powder snow japan, custom ski packages japan, japanese ski culture, tourism, tailor-made japan ski holidays, hakuba valley, nozawa onsen, ski travel insurance japan, ski lessons japan, luxury ski holidays japan, furano ski, ski and snowboard trips japan, ski equipment rental japan, private ski guides japan, recreational services, b2c, services, travel agencies, leisure, travel & tourism",0,,,,,,,,,https://app.apollo.io/#/companies?organizationNumEmployeesRanges%5B%5D=101%2C200&organizationNumEmployeesRanges%5B%5D=51%2C100&organizationNumEmployeesRanges%5B%5D=21%2C50&organizationNumEmployeesRanges%5B%5D=11%2C20&organizationNumEmployeesRanges%5B%5D=1%2C10&organizationLocations%5B%5D=United%20States&organizationLocations%5B%5D=Canada&organizationLocations%5B%5D=Europe&organizationLocations%5B%5D=Japan&organizationLocations%5B%5D=New%20Zealand&organizationLocations%5B%5D=Australia&qOrganizationKeywordTags%5B%5D=snow&qOrganizationKeywordTags%5B%5D=winter&qOrganizationKeywordTags%5B%5D=winter%20sports&qOrganizationKeywordTags%5B%5D=winter%20activities&qOrganizationKeywordTags%5B%5D=arctic&qOrganizationKeywordTags%5B%5D=tour%20operators&qOrganizationKeywordTags%5B%5D=sightseeing%20tours&qOrganizationKeywordTags%5B%5D=travel%20agency&qOrganizationKeywordTags%5B%5D=snowboarding&qOrganizationKeywordTags%5B%5D=skiing&qOrganizationKeywordTags%5B%5D=polar&includedOrganizationKeywordFields%5B%5D=tags&includedOrganizationKeywordFields%5B%5D=name&organizationIndustryTagIds%5B%5D=5567cdd87369643bc12f0000&revenueRange%5Bmax%5D=5000000&page=1&sortAscending=false&sortByField=recommendations_score,,,,,,,,,,,,,,,,,,,,
Powderbird Helicopter Skiing,recBGp7gsaWHnEPsm,Processed,0.0,0,0.00%,0.00%,0.00%,0.00%,0.00%,0.00%,[],0,0,Snowbird,"Snowbird, Utah | 500""+ annual snowfall, 3,000 vertical feet & 2,500 acres of legendary skiing & snowboarding terrain in Utah.",[],True,False,2025-06-01 02:00,2025-06-01,0,2025-05-01,0,2025-04-01,0,"{""similarwebcompletedata"":{""visits"":0,""bouncerate"":0,""pagespervisit"":0,""timeonsite"":0,""trafficsources"":{""Social"":0,""Paid Referrals"":0,""Mail"":0,""Referrals"":0,""Search"":0,""Direct"":0},""topcountries"":[],""rankings"":{""global"":0,""country"":0,""category"":{""Rank"":null,""Category"":null}},""topkeywords"":[],""snapshotdate"":""2025-06-01T00:00:00+00:00"",""estimatedmonthlyvisits"":{""2025-04-01"":0,""2025-05-01"":0,""2025-06-01"":0}},""processinginfo"":{""processedat"":""2025-07-31T09:41:14.257Z"",""domain"":""powderbird.com"",""company"":""Powderbird Helicopter Skiing"",""originaldomain"":""powderbird.com""}}",2025-07_C002_WinterTour_GamifiedChatbot,http://www.powderbird.com,powderbird.com,"[""international travel expeditions"",""guided helicopter ski snowboard tours"",""helicopter assisted avalanche control work alpine tours"",""helicopter assisted avalanche control work amp alpine tours"",""international travel amp expeditions"",""guided helicopter ski amp snowboard tours"",""certified professional guides"",""over 40 years of experience in utah"",""recreational facilities"",""skiing"",""ski and snowboard rentals"",""ski passes"",""adaptive sports"",""mountain safety"",""group events"",""snowboarding"",""fast tracks"",""community engagement"",""ski lessons"",""heli-skiing"",""the cliff spa"",""lift tickets"",""vip lift access"",""backcountry adventures"",""ski resort"",""adventure experiences"",""lodge accommodations"",""wedding venues"",""deals and discounts"",""community events"",""outdoor recreation"",""mountain safety protocols"",""backcountry skiing"",""mountain upgrades"",""season passes"",""mountain report"",""event hosting"",""guided lessons"",""mountain activities"",""snowbird & save"",""leisure, travel & tourism"",""recreation"",""hospitality"",""webcams"",""powderbird heli-skiing"",""winter sports"",""summer activities"",""ski terrain"",""lodging"",""guided tours"",""powderbird helicopter skiing"",""b2c"",""e-commerce"",""d2c"",""services"",""retail"",""fitness and recreational sports centers"",""events"",""shopping"",""yoga"",""customer service"",""facilities services"",""consumer internet"",""consumers"",""internet"",""information technology & services"",""hotels & travel"",""ski resorts"",""tours""]",0,"8333 alta bypass rd, snowbird, utah, united states",Sandy,Utah,United States,http://www.linkedin.com/company/wasatch-powderbird-guides,,18017422800,,,,,,,,,"international travel expeditions, guided helicopter ski snowboard tours, helicopter assisted avalanche control work alpine tours, helicopter assisted avalanche control work amp alpine tours, international travel amp expeditions, guided helicopter ski amp snowboard tours, certified professional guides, over 40 years of experience in utah, recreational facilities, skiing, ski and snowboard rentals, ski passes, adaptive sports, mountain safety, group events, snowboarding, fast tracks, community engagement, ski lessons, heli-skiing, the cliff spa, lift tickets, vip lift access, backcountry adventures, ski resort, adventure experiences, lodge accommodations, wedding venues, deals and discounts, community events, outdoor recreation, mountain safety protocols, backcountry skiing, mountain upgrades, season passes, mountain report, event hosting, guided lessons, mountain activities, snowbird & save, leisure, travel & tourism, recreation, hospitality, webcams, powderbird heli-skiing, winter sports, summer activities, ski terrain, lodging, guided tours, powderbird helicopter skiing, b2c, e-commerce, d2c, services, retail, fitness and recreational sports centers, events, shopping, yoga, customer service, facilities services, consumer internet, consumers, internet, information technology & services, hotels & travel, ski resorts, tours",0,,,,,,,,,https://app.apollo.io/#/companies?organizationNumEmployeesRanges%5B%5D=101%2C200&organizationNumEmployeesRanges%5B%5D=51%2C100&organizationNumEmployeesRanges%5B%5D=21%2C50&organizationNumEmployeesRanges%5B%5D=11%2C20&organizationNumEmployeesRanges%5B%5D=1%2C10&organizationLocations%5B%5D=United%20States&organizationLocations%5B%5D=Canada&organizationLocations%5B%5D=Europe&organizationLocations%5B%5D=Japan&organizationLocations%5B%5D=New%20Zealand&organizationLocations%5B%5D=Australia&qOrganizationKeywordTags%5B%5D=snow&qOrganizationKeywordTags%5B%5D=winter&qOrganizationKeywordTags%5B%5D=winter%20sports&qOrganizationKeywordTags%5B%5D=winter%20activities&qOrganizationKeywordTags%5B%5D=arctic&qOrganizationKeywordTags%5B%5D=tour%20operators&qOrganizationKeywordTags%5B%5D=sightseeing%20tours&qOrganizationKeywordTags%5B%5D=travel%20agency&qOrganizationKeywordTags%5B%5D=snowboarding&qOrganizationKeywordTags%5B%5D=skiing&qOrganizationKeywordTags%5B%5D=polar&includedOrganizationKeywordFields%5B%5D=tags&includedOrganizationKeywordFields%5B%5D=name&organizationIndustryTagIds%5B%5D=5567cdd87369643bc12f0000&revenueRange%5Bmax%5D=5000000&page=1&sortAscending=false&sortByField=recommendations_score,,,,,,,,,,,,,,,,,,,,
Cardrona Alpine Resort,recsC2Yr3FwqZZ2no,Processed,2.85,119,37.73%,48.09%,1.43%,11.87%,0.72%,0.16%,"[{""Country"":554,""CountryCode"":""NZ"",""Value"":0.6705830799432551},{""Country"":36,""CountryCode"":""AU"",""Value"":0.23422730437337053},{""Country"":840,""CountryCode"":""US"",""Value"":0.03173502237604888},{""Country"":756,""CountryCode"":""CH"",""Value"":0.018624758077091064},{""Country"":344,""CountryCode"":""HK"",""Value"":0.008773088273869011}]",193672,554,Cardrona Alpine Resort | Wanaka & Queenstown Ski Field,"Discover Cardrona and Treble Cone ski fields in Wanaka and Queenstown, New Zealand. This is NZ’s ultimate alpine winter and summer playground. Book now.","[{""Name"":""cardrona"",""EstimatedValue"":6420,""Volume"":9520,""Cpc"":0.3},{""Name"":""cardrona ski"",""EstimatedValue"":1830,""Volume"":940,""Cpc"":0.59},{""Name"":""treble cone"",""EstimatedValue"":1660,""Volume"":3450,""Cpc"":0.35},{""Name"":""treblecone"",""EstimatedValue"":1110,""Volume"":600,""Cpc"":null},{""Name"":""cardrona alpine resort"",""EstimatedValue"":830,""Volume"":1120,""Cpc"":0.4}]",False,False,2025-06-01 02:00,2025-06-01,215218,2025-05-01,78475,2025-04-01,53686,"{""similarwebcompletedata"":{""visits"":215218,""bouncerate"":0.4716686443931935,""pagespervisit"":2.8471069059813185,""timeonsite"":118.94945576203104,""trafficsources"":{""Social"":0.014296183973353716,""Paid Referrals"":0.007227238896540602,""Mail"":0.0015661030332334144,""Referrals"":0.11873232788073482,""Search"":0.4809197625602174,""Direct"":0.3772583836549187},""topcountries"":[{""Country"":554,""CountryCode"":""NZ"",""Value"":0.6705830799432551},{""Country"":36,""CountryCode"":""AU"",""Value"":0.23422730437337053},{""Country"":840,""CountryCode"":""US"",""Value"":0.03173502237604888}],""rankings"":{""global"":193672,""country"":1308,""category"":{""Rank"":""1"",""Category"":""Sports/WinterSports""}},""topkeywords"":[{""Name"":""cardrona"",""EstimatedValue"":6420,""Volume"":9520,""Cpc"":0.3},{""Name"":""cardrona ski"",""EstimatedValue"":1830,""Volume"":940,""Cpc"":0.59},{""Name"":""treble cone"",""EstimatedValue"":1660,""Volume"":3450,""Cpc"":0.35},{""Name"":""treblecone"",""EstimatedValue"":1110,""Volume"":600,""Cpc"":null},{""Name"":""cardrona alpine resort"",""EstimatedValue"":830,""Volume"":1120,""Cpc"":0.4}],""snapshotdate"":""2025-06-01T00:00:00+00:00"",""estimatedmonthlyvisits"":{""2025-04-01"":53686,""2025-05-01"":78475,""2025-06-01"":215218}},""processinginfo"":{""processedat"":""2025-07-31T09:41:14.280Z"",""domain"":""cardrona-treblecone.com"",""company"":""Cardrona Alpine Resort"",""original_domain"":""cardrona-treblecone.com""}}",2025-07_C002_WinterTour_GamifiedChatbot,http://www.cardrona-treblecone.com,cardrona-treblecone.com,"[""skiing"",""snowboarding"",""adaptive sports"",""mountain biking"",""walking"",""hiking"",""tubing"",""sightseeing"",""mountain carting"",""travel arrangements"",""nz's largest ski area"",""lessons and rentals"",""tourism"",""summer mountain activities"",""alpine ski resorts"",""season passes"",""adventure tourism"",""ski lifts"",""outdoor recreation"",""summer activities"",""cardrona"",""ski instruction"",""mountain carting australia"",""skiing and snowboarding"",""carting trails"",""adaptive skiing"",""sustainability initiatives"",""ski terrain"",""webcams"",""new terrain 2025"",""ski resorts"",""ski passes"",""mountain safety"",""off-piste terrain nz"",""southern alps views"",""event hosting"",""family-friendly"",""mountain scenery"",""terrain parks"",""mountain biking passes"",""sightseeing tours"",""private lessons"",""trail maps"",""treble cone"",""skiing for all levels"",""mountain biking nz"",""snow conditions"",""leisure, travel and tourism"",""groomed runs"",""mountain conservation"",""longest groomed run nz"",""mountain resort development"",""b2c"",""e-commerce"",""d2c"",""services"",""retail"",""fitness and recreational sports centers"",""food and beverage"",""customer service"",""leisure, travel & tourism"",""consumer internet"",""consumers"",""internet"",""information technology & services"",""food & beverages"",""consumer goods""]",160,cardrona valley road,Cardrona,Otago,New Zealand,http://www.linkedin.com/company/cardrona-alpine-resort,,64800440800,,,,,,,,,"skiing, snowboarding, adaptive sports, mountain biking, walking, hiking, tubing, sightseeing, mountain carting, travel arrangements, nz's largest ski area, lessons and rentals, tourism, summer mountain activities, alpine ski resorts, season passes, adventure tourism, ski lifts, outdoor recreation, summer activities, cardrona, ski instruction, mountain carting australia, skiing and snowboarding, carting trails, adaptive skiing, sustainability initiatives, ski terrain, webcams, new terrain 2025, ski resorts, ski passes, mountain safety, off-piste terrain nz, southern alps views, event hosting, family-friendly, mountain scenery, terrain parks, mountain biking passes, sightseeing tours, private lessons, trail maps, treble cone, skiing for all levels, mountain biking nz, snow conditions, leisure, travel and tourism, groomed runs, mountain conservation, longest groomed run nz, mountain resort development, b2c, e-commerce, d2c, services, retail, fitness and recreational sports centers, food and beverage, customer service, leisure, travel & tourism, consumer internet, consumers, internet, information technology & services, food & beverages, consumer goods",108000,,,,,,,,,https://app.apollo.io/#/companies?organizationNumEmployeesRanges%5B%5D=101%2C200&organizationNumEmployeesRanges%5B%5D=51%2C100&organizationNumEmployeesRanges%5B%5D=21%2C50&organizationNumEmployeesRanges%5B%5D=11%2C20&organizationNumEmployeesRanges%5B%5D=1%2C10&organizationLocations%5B%5D=United%20States&organizationLocations%5B%5D=Canada&organizationLocations%5B%5D=Europe&organizationLocations%5B%5D=Japan&organizationLocations%5B%5D=New%20Zealand&organizationLocations%5B%5D=Australia&qOrganizationKeywordTags%5B%5D=snow&qOrganizationKeywordTags%5B%5D=winter&qOrganizationKeywordTags%5B%5D=winter%20sports&qOrganizationKeywordTags%5B%5D=winter%20activities&qOrganizationKeywordTags%5B%5D=arctic&qOrganizationKeywordTags%5B%5D=tour%20operators&qOrganizationKeywordTags%5B%5D=sightseeing%20tours&qOrganizationKeywordTags%5B%5D=travel%20agency&qOrganizationKeywordTags%5B%5D=snowboarding&qOrganizationKeywordTags%5B%5D=skiing&qOrganizationKeywordTags%5B%5D=polar&includedOrganizationKeywordFields%5B%5D=tags&includedOrganizationKeywordFields%5B%5D=name&organizationIndustryTagIds%5B%5D=5567cdd87369643bc12f0000&revenueRange%5Bmax%5D=5000000&page=1&sortAscending=false&sortByField=recommendations_score,,,,,,,,,,,,,,,,,,,,
